{
  "recipe_name": "Cutler Common Equity",
  "recipe_type": "COMMON_EQUITY",
  "security_type": "Common Equity",
  "recipe_version": 1,
  "description": "Approved normalized Cutler common-equity research package recipe.",
  "slots": [
    {
      "order_number": 1,
      "suborder": 0,
      "display_name": "BBG-DES",
      "normalized_slot_type": "bbg_des",
      "section_code": "COMPANY_SNAPSHOT",
      "section_name": "Company Snapshot",
      "required_level": "RECOMMENDED",
      "long_applicable": true,
      "short_applicable": true,
      "conditional_rule": null,
      "preferred_sources": [
        "Bloomberg Terminal"
      ],
      "fallback_sources": [],
      "instructions": "Y",
      "minimum_documents": 1,
      "maximum_documents": 1,
      "freshness_rule": null,
      "anchor_rule": null,
      "allowed_document_types": [],
      "expected_output_format": "Source document",
      "automatic_availability": false,
      "manual_upload_allowed": true,
      "analyst_review_required": true,
      "default_status": "MANUAL_UPLOAD_REQUIRED",
      "enabled": true
    },
    {
      "order_number": 2,
      "suborder": 0,
      "display_name": "BBG-DVD",
      "normalized_slot_type": "bbg_dvd",
      "section_code": "COMPANY_SNAPSHOT",
      "section_name": "Company Snapshot",
      "required_level": "RECOMMENDED",
      "long_applicable": true,
      "short_applicable": true,
      "conditional_rule": null,
      "preferred_sources": [
        "Bloomberg Terminal"
      ],
      "fallback_sources": [],
      "instructions": "Y",
      "minimum_documents": 1,
      "maximum_documents": 1,
      "freshness_rule": null,
      "anchor_rule": null,
      "allowed_document_types": [],
      "expected_output_format": "Source document",
      "automatic_availability": false,
      "manual_upload_allowed": true,
      "analyst_review_required": true,
      "default_status": "MANUAL_UPLOAD_REQUIRED",
      "enabled": true
    },
    {
      "order_number": 3,
      "suborder": 0,
      "display_name": "BBG-DDIS",
      "normalized_slot_type": "bbg_ddis",
      "section_code": "COMPANY_SNAPSHOT",
      "section_name": "Company Snapshot",
      "required_level": "CONDITIONAL",
      "long_applicable": true,
      "short_applicable": true,
      "conditional_rule": "Analyst determines applicability and records a reason.",
      "preferred_sources": [
        "Bloomberg Terminal"
      ],
      "fallback_sources": [],
      "instructions": "Y",
      "minimum_documents": 1,
      "maximum_documents": 1,
      "freshness_rule": null,
      "anchor_rule": null,
      "allowed_document_types": [],
      "expected_output_format": "Source document",
      "automatic_availability": false,
      "manual_upload_allowed": true,
      "analyst_review_required": true,
      "default_status": "MANUAL_UPLOAD_REQUIRED",
      "enabled": true
    },
    {
      "order_number": 4,
      "suborder": 0,
      "display_name": "BBG-HDS",
      "normalized_slot_type": "bbg_hds",
      "section_code": "COMPANY_SNAPSHOT",
      "section_name": "Company Snapshot",
      "required_level": "RECOMMENDED",
      "long_applicable": true,
      "short_applicable": true,
      "conditional_rule": null,
      "preferred_sources": [
        "Bloomberg Terminal"
      ],
      "fallback_sources": [],
      "instructions": "Y",
      "minimum_documents": 1,
      "maximum_documents": 1,
      "freshness_rule": null,
      "anchor_rule": null,
      "allowed_document_types": [],
      "expected_output_format": "Source document",
      "automatic_availability": false,
      "manual_upload_allowed": true,
      "analyst_review_required": true,
      "default_status": "MANUAL_UPLOAD_REQUIRED",
      "enabled": true
    },
    {
      "order_number": 5,
      "suborder": 0,
      "display_name": "Hoover Report",
      "normalized_slot_type": "hoover_report",
      "section_code": "COMPANY_SNAPSHOT",
      "section_name": "Company Snapshot",
      "required_level": "RECOMMENDED",
      "long_applicable": true,
      "short_applicable": true,
      "conditional_rule": null,
      "preferred_sources": [
        "Bloomberg Terminal"
      ],
      "fallback_sources": [],
      "instructions": "Y",
      "minimum_documents": 1,
      "maximum_documents": 1,
      "freshness_rule": null,
      "anchor_rule": null,
      "allowed_document_types": [],
      "expected_output_format": "Source document",
      "automatic_availability": false,
      "manual_upload_allowed": true,
      "analyst_review_required": true,
      "default_status": "MANUAL_UPLOAD_REQUIRED",
      "enabled": true
    },
    {
      "order_number": 6,
      "suborder": 0,
      "display_name": "Morningstar Report and Most Recent Model",
      "normalized_slot_type": "morningstar_report_and_most_recent_model",
      "section_code": "COMPANY_SNAPSHOT",
      "section_name": "Company Snapshot",
      "required_level": "RECOMMENDED",
      "long_applicable": true,
      "short_applicable": true,
      "conditional_rule": null,
      "preferred_sources": [
        "Pitchbook (Report); Bloomberg Terminal (Model)"
      ],
      "fallback_sources": [],
      "instructions": "-",
      "minimum_documents": 1,
      "maximum_documents": 1,
      "freshness_rule": null,
      "anchor_rule": null,
      "allowed_document_types": [],
      "expected_output_format": "Source document",
      "automatic_availability": false,
      "manual_upload_allowed": true,
      "analyst_review_required": true,
      "default_status": "MANUAL_UPLOAD_REQUIRED",
      "enabled": true
    },
    {
      "order_number": 7,
      "suborder": 0,
      "display_name": "BBG-ANR",
      "normalized_slot_type": "bbg_anr",
      "section_code": "COMPANY_SNAPSHOT",
      "section_name": "Company Snapshot",
      "required_level": "RECOMMENDED",
      "long_applicable": true,
      "short_applicable": true,
      "conditional_rule": null,
      "preferred_sources": [
        "Bloomberg Terminal"
      ],
      "fallback_sources": [],
      "instructions": "Y",
      "minimum_documents": 1,
      "maximum_documents": 1,
      "freshness_rule": null,
      "anchor_rule": null,
      "allowed_document_types": [],
      "expected_output_format": "Source document",
      "automatic_availability": false,
      "manual_upload_allowed": true,
      "analyst_review_required": true,
      "default_status": "MANUAL_UPLOAD_REQUIRED",
      "enabled": true
    },
    {
      "order_number": 8,
      "suborder": 0,
      "display_name": "Sell-Side Reports",
      "normalized_slot_type": "sell_side_reports",
      "section_code": "LICENSED_RESEARCH",
      "section_name": "Licensed and Third-Party Research",
      "required_level": "RECOMMENDED",
      "long_applicable": true,
      "short_applicable": true,
      "conditional_rule": null,
      "preferred_sources": [
        "JPM, Goldman, Evercore"
      ],
      "fallback_sources": [],
      "instructions": "Y",
      "minimum_documents": 1,
      "maximum_documents": 12,
      "freshness_rule": null,
      "anchor_rule": null,
      "allowed_document_types": [],
      "expected_output_format": "Source document",
      "automatic_availability": false,
      "manual_upload_allowed": true,
      "analyst_review_required": true,
      "default_status": "MANUAL_UPLOAD_REQUIRED",
      "enabled": true
    },
    {
      "order_number": 9,
      "suborder": 0,
      "display_name": "Credit Reports",
      "normalized_slot_type": "credit_reports",
      "section_code": "LICENSED_RESEARCH",
      "section_name": "Licensed and Third-Party Research",
      "required_level": "RECOMMENDED",
      "long_applicable": true,
      "short_applicable": true,
      "conditional_rule": null,
      "preferred_sources": [
        "Moody's, S&P, GimmeCredit"
      ],
      "fallback_sources": [],
      "instructions": "-",
      "minimum_documents": 1,
      "maximum_documents": 5,
      "freshness_rule": null,
      "anchor_rule": null,
      "allowed_document_types": [],
      "expected_output_format": "Source document",
      "automatic_availability": false,
      "manual_upload_allowed": true,
      "analyst_review_required": true,
      "default_status": "MANUAL_UPLOAD_REQUIRED",
      "enabled": true
    },
    {
      "order_number": 10,
      "suborder": 0,
      "display_name": "Initiated Coverage Report",
      "normalized_slot_type": "initiated_coverage_report",
      "section_code": "LICENSED_RESEARCH",
      "section_name": "Licensed and Third-Party Research",
      "required_level": "RECOMMENDED",
      "long_applicable": true,
      "short_applicable": true,
      "conditional_rule": null,
      "preferred_sources": [
        "research database (jpm, mornigstar etc, jefferies etc)."
      ],
      "fallback_sources": [],
      "instructions": "Y",
      "minimum_documents": 1,
      "maximum_documents": 1,
      "freshness_rule": null,
      "anchor_rule": null,
      "allowed_document_types": [],
      "expected_output_format": "Source document",
      "automatic_availability": false,
      "manual_upload_allowed": true,
      "analyst_review_required": true,
      "default_status": "MANUAL_UPLOAD_REQUIRED",
      "enabled": true
    },
    {
      "order_number": 10,
      "suborder": 1,
      "display_name": "Sell-Side Downgrade",
      "normalized_slot_type": "sell_side_downgrade",
      "section_code": "LICENSED_RESEARCH",
      "section_name": "Licensed and Third-Party Research",
      "required_level": "CONDITIONAL",
      "long_applicable": true,
      "short_applicable": true,
      "conditional_rule": "Analyst determines applicability and records a reason.",
      "preferred_sources": [],
      "fallback_sources": [],
      "instructions": "",
      "minimum_documents": 1,
      "maximum_documents": 1,
      "freshness_rule": null,
      "anchor_rule": null,
      "allowed_document_types": [],
      "expected_output_format": "Source document",
      "automatic_availability": false,